{
  "schemaVersion": "quality-dataset-manifest.v1",
  "datasetId": "quality-dataset.r07.synthetic",
  "datasetVersion": "v1",
  "telemetrySchemaVersion": "telemetry-batch.v2",
  "labelSchemaVersion": "quality-label.v1",
  "featureSchemaVersion": "quality-features.v1",
  "generatorVersion": "r07-generator.v1",
  "splitStrategy": "group-time-holdout.v1",
  "seed": 20260811,
  "sourceKind": "synthetic",
  "createdAt": "2026-08-11T09:00:00Z",
  "datasetSha256": "aaaaaaaaaaaaaaaaaaaaaaaaaaaaaaaaaaaaaaaaaaaaaaaaaaaaaaaaaaaaaaaa",
  "traceCount": 4,
  "labelCounts": {
    "mobility_aid_likely": 1,
    "vehicle_likely": 1,
    "stationary": 1,
    "gps_noise_or_insufficient": 1,
    "review_required": 0,
    "abstained": 0
  },
  "splitCounts": {
    "train": 2,
    "validation": 1,
    "test": 1
  },
  "traces": [
    {
      "traceId": "7b6c25a9-e20d-4a1f-9a4f-84b29de2f1a8",
      "telemetryBatchId": "d6a6e478-20d4-4608-89f1-7980c98844e0",
      "scenarioGroupId": "synthetic-mobility-0001",
      "labelId": "0f4b6fd7-25cd-4a72-88e9-bc0a4bb2b4f6",
      "sourceKind": "synthetic",
      "split": "train",
      "capturedAt": "2026-08-01T09:00:00Z",
      "sampleCount": 12,
      "telemetrySha256": "1111111111111111111111111111111111111111111111111111111111111111",
      "benchmarkEligible": true
    },
    {
      "traceId": "327c0a46-2fd8-4f29-b3b9-2bcae10eaf24",
      "telemetryBatchId": "4c00f90a-9653-423f-9dc4-b4d8a4f04e12",
      "scenarioGroupId": "synthetic-vehicle-0001",
      "labelId": "a2a65fdc-0b3e-4b78-9f5e-0a7a3c4ce602",
      "sourceKind": "synthetic",
      "split": "train",
      "capturedAt": "2026-08-02T09:00:00Z",
      "sampleCount": 12,
      "telemetrySha256": "2222222222222222222222222222222222222222222222222222222222222222",
      "benchmarkEligible": true
    },
    {
      "traceId": "1f0669d1-6596-4fac-89d6-146602129e28",
      "telemetryBatchId": "39fd50a8-cb1f-4543-a490-c3c92ab2aa73",
      "scenarioGroupId": "synthetic-stationary-0001",
      "labelId": "1b59d93c-7b8c-4c5b-885b-a55f7cb3a1cb",
      "sourceKind": "synthetic",
      "split": "validation",
      "capturedAt": "2026-08-03T09:00:00Z",
      "sampleCount": 12,
      "telemetrySha256": "3333333333333333333333333333333333333333333333333333333333333333",
      "benchmarkEligible": true
    },
    {
      "traceId": "d9f6fc2f-8f9a-4554-b845-8dbb4b4ad8f1",
      "telemetryBatchId": "e4bb9cfd-7dc6-4d57-aad8-95c5b7d4d542",
      "scenarioGroupId": "synthetic-noise-0001",
      "labelId": "5a74a66c-2c15-4a34-9ee4-2cb706a66434",
      "sourceKind": "synthetic",
      "split": "test",
      "capturedAt": "2026-08-04T09:00:00Z",
      "sampleCount": 12,
      "telemetrySha256": "4444444444444444444444444444444444444444444444444444444444444444",
      "benchmarkEligible": true
    }
  ]
}
